{
  "schemaVersion": "1.0.0",
  "registryVersion": "0.9.0",
  "status": "provisional",
  "measurementTypes": [
    "monopolar",
    "bipolar",
    "affinity",
    "categorical",
    "hierarchical",
    "derived"
  ],
  "tiers": [
    "headline",
    "primary",
    "diagnostic",
    "research"
  ],
  "outputModes": [
    "independent_meter",
    "bipolar_bar",
    "affinity_card",
    "affinity_group",
    "branch_classification",
    "grouped_facets",
    "hidden_derived"
  ],
  "constructs": [
    {
      "id": "ME01",
      "domainId": "ME",
      "name": "Moral stance-independence / objectivity",
      "type": "monopolar",
      "tier": "headline",
      "description": "Degree to which moral truth or correctness is treated as independent of individual or group attitudes.",
      "candidateItemTarget": 5,
      "outputMode": "independent_meter",
      "evidenceBasis": [
        "philpapers-2020"
      ],
      "prerequisites": [],
      "measurementStatus": "provisional",
      "directlyScored": true
    },
    {
      "id": "ME02",
      "domainId": "ME",
      "name": "Universal applicability of moral claims",
      "type": "monopolar",
      "tier": "primary",
      "description": "Degree to which moral requirements are thought to apply across persons, groups, and contexts.",
      "candidateItemTarget": 4,
      "outputMode": "independent_meter",
      "evidenceBasis": [
        "project-theory"
      ],
      "prerequisites": [],
      "measurementStatus": "provisional",
      "directlyScored": true
    },
    {
      "id": "ME03",
      "domainId": "ME",
      "name": "Moral context-sensitivity",
      "type": "monopolar",
      "tier": "primary",
      "description": "Degree to which morally relevant context can change the correct judgment.",
      "candidateItemTarget": 4,
      "outputMode": "independent_meter",
      "evidenceBasis": [
        "project-theory"
      ],
      "prerequisites": [],
      "measurementStatus": "provisional",
      "directlyScored": true
    },
    {
      "id": "ME04",
      "domainId": "ME",
      "name": "Generalism vs particularism",
      "type": "bipolar",
      "tier": "primary",
      "description": "Whether moral judgment is primarily governed by general principles or irreducibly particular features.",
      "candidateItemTarget": 4,
      "outputMode": "bipolar_bar",
      "evidenceBasis": [
        "philpapers-2020"
      ],
      "prerequisites": [],
      "measurementStatus": "provisional",
      "directlyScored": true
    },
    {
      "id": "ME05",
      "domainId": "ME",
      "name": "Categorical moral reasons",
      "type": "monopolar",
      "tier": "primary",
      "description": "Degree to which moral reasons bind independently of an agent's contingent goals or preferences.",
      "candidateItemTarget": 4,
      "outputMode": "independent_meter",
      "evidenceBasis": [
        "project-theory"
      ],
      "prerequisites": [],
      "measurementStatus": "provisional",
      "directlyScored": true
    },
    {
      "id": "ME06",
      "domainId": "ME",
      "name": "Moral truth-aptness",
      "type": "categorical",
      "tier": "diagnostic",
      "description": "Whether moral assertions are treated as the kind of claims that can literally be true or false.",
      "candidateItemTarget": 4,
      "outputMode": "branch_classification",
      "evidenceBasis": [
        "philpapers-2020"
      ],
      "prerequisites": [],
      "measurementStatus": "provisional",
      "directlyScored": true
    },
    {
      "id": "ME07",
      "domainId": "ME",
      "name": "Metaethical family",
      "type": "derived",
      "tier": "diagnostic",
      "description": "Derived classification over realist, constructivist, subjectivist, error-theoretic, noncognitivist, and related families.",
      "candidateItemTarget": 0,
      "outputMode": "hidden_derived",
      "evidenceBasis": [
        "philpapers-2020"
      ],
      "prerequisites": [
        "ME01",
        "ME02",
        "ME03",
        "ME05",
        "ME06"
      ],
      "measurementStatus": "provisional",
      "directlyScored": false
    },
    {
      "id": "ME08",
      "domainId": "ME",
      "name": "Moral motivation internalism / externalism",
      "type": "categorical",
      "tier": "research",
      "description": "Whether sincere moral judgment is conceptually or necessarily connected to motivation.",
      "candidateItemTarget": 3,
      "outputMode": "branch_classification",
      "evidenceBasis": [
        "philpapers-2020"
      ],
      "prerequisites": [],
      "measurementStatus": "provisional",
      "directlyScored": true
    },
    {
      "id": "NE01",
      "domainId": "NE",
      "name": "Consequence sensitivity",
      "type": "monopolar",
      "tier": "headline",
      "description": "Weight given to aggregate or outcome-based consequences in moral evaluation.",
      "candidateItemTarget": 5,
      "outputMode": "independent_meter",
      "evidenceBasis": [
        "project-theory"
      ],
      "prerequisites": [],
      "measurementStatus": "provisional",
      "directlyScored": true
    },
    {
      "id": "NE02",
      "domainId": "NE",
      "name": "Deontic constraint strength",
      "type": "monopolar",
      "tier": "headline",
      "description": "Strength of moral constraints against otherwise beneficial actions.",
      "candidateItemTarget": 5,
      "outputMode": "independent_meter",
      "evidenceBasis": [
        "project-theory"
      ],
      "prerequisites": [],
      "measurementStatus": "provisional",
      "directlyScored": true
    },
    {
      "id": "NE03",
      "domainId": "NE",
      "name": "Virtue and character orientation",
      "type": "affinity",
      "tier": "headline",
      "description": "Affinity for evaluating conduct through character, virtues, and practical excellence.",
      "candidateItemTarget": 4,
      "outputMode": "affinity_card",
      "evidenceBasis": [
        "project-theory"
      ],
      "prerequisites": [],
      "measurementStatus": "provisional",
      "directlyScored": true
    },
    {
      "id": "NE04",
      "domainId": "NE",
      "name": "Care and relational orientation",
      "type": "affinity",
      "tier": "headline",
      "description": "Affinity for relationship-sensitive, dependency-sensitive, and care-centered moral reasoning.",
      "candidateItemTarget": 4,
      "outputMode": "affinity_card",
      "evidenceBasis": [
        "project-theory"
      ],
      "prerequisites": [],
      "measurementStatus": "provisional",
      "directlyScored": true
    },
    {
      "id": "NE05",
      "domainId": "NE",
      "name": "Contractualist non-rejectability",
      "type": "affinity",
      "tier": "primary",
      "description": "Affinity for principles justifiable to each person under reasonable rejection constraints.",
      "candidateItemTarget": 4,
      "outputMode": "affinity_card",
      "evidenceBasis": [
        "project-theory"
      ],
      "prerequisites": [],
      "measurementStatus": "provisional",
      "directlyScored": true
    },
    {
      "id": "NE06",
      "domainId": "NE",
      "name": "Contractarian mutual advantage",
      "type": "affinity",
      "tier": "primary",
      "description": "Affinity for morality grounded in mutually advantageous agreement among agents.",
      "candidateItemTarget": 4,
      "outputMode": "affinity_card",
      "evidenceBasis": [
        "project-theory"
      ],
      "prerequisites": [],
      "measurementStatus": "provisional",
      "directlyScored": true
    },
    {
      "id": "NE07",
      "domainId": "NE",
      "name": "Impartial beneficence",
      "type": "monopolar",
      "tier": "headline",
      "description": "Willingness to give equal moral weight to distant or unfamiliar persons and make demanding sacrifices for their welfare.",
      "candidateItemTarget": 5,
      "outputMode": "independent_meter",
      "evidenceBasis": [
        "oxford-utilitarianism"
      ],
      "prerequisites": [],
      "measurementStatus": "provisional",
      "directlyScored": true
    },
    {
      "id": "NE08",
      "domainId": "NE",
      "name": "Instrumental-harm permissiveness",
      "type": "monopolar",
      "tier": "headline",
      "description": "Willingness to cause harm instrumentally when doing so produces sufficiently better outcomes.",
      "candidateItemTarget": 5,
      "outputMode": "independent_meter",
      "evidenceBasis": [
        "oxford-utilitarianism"
      ],
      "prerequisites": [],
      "measurementStatus": "provisional",
      "directlyScored": true
    },
    {
      "id": "NE09",
      "domainId": "NE",
      "name": "Special obligations and partiality",
      "type": "monopolar",
      "tier": "primary",
      "description": "Weight assigned to special obligations to family, friends, associates, or compatriots.",
      "candidateItemTarget": 4,
      "outputMode": "independent_meter",
      "evidenceBasis": [
        "project-theory"
      ],
      "prerequisites": [],
      "measurementStatus": "provisional",
      "directlyScored": true
    },
    {
      "id": "NE10",
      "domainId": "NE",
      "name": "Agent-relative prerogatives / self-priority",
      "type": "monopolar",
      "tier": "primary",
      "description": "Extent to which agents may give their own projects or welfare priority over impersonal demands.",
      "candidateItemTarget": 4,
      "outputMode": "independent_meter",
      "evidenceBasis": [
        "project-theory"
      ],
      "prerequisites": [],
      "measurementStatus": "provisional",
      "directlyScored": true
    },
    {
      "id": "NE11",
      "domainId": "NE",
      "name": "Moral demandingness",
      "type": "monopolar",
      "tier": "primary",
      "description": "Extent to which morality may require substantial sacrifice beyond ordinary expectations.",
      "candidateItemTarget": 4,
      "outputMode": "independent_meter",